{"apiVersion":"nexa.dev/frontend-renderer/v1","extensionScopes":["frontend/extensions"],"frontendIR":{"api":{"apiVersion":"nexa.dev/http-api-ir/v1","kind":"HTTPAPIIR","operations":[{"auth":{"credentials":[{"id":"primary","in":"header","name":"authorization","type":"bearer"}],"mode":"required"},"errorProjections":[],"id":"account.create","method":"POST","path":"/accounts","permission":"account.write","provenance":{"kind":"native","sources":["repo:api.api#route%3APOST%20%2Faccounts"]},"requestType":"CreateRequest","responseBody":"none"},{"auth":{"credentials":[{"id":"primary","in":"header","name":"authorization","type":"bearer"}],"mode":"required"},"errorProjections":[],"id":"account.delete","method":"DELETE","path":"/accounts/{id}","permission":"account.write","provenance":{"kind":"native","sources":["repo:api.api#route%3ADELETE%20%2Faccounts%2F%7Bid%7D"]},"requestType":"DeleteRequest","responseBody":"none"},{"auth":{"credentials":[{"id":"primary","in":"header","name":"authorization","type":"bearer"}],"mode":"required"},"errorProjections":[],"id":"account.get","method":"GET","path":"/account","permission":"account.read","provenance":{"kind":"native","sources":["repo:api.api#route%3AGET%20%2Faccount"]},"requestType":"GetRequest","responseBody":"json","responseType":"Account"},{"auth":{"credentials":[{"id":"primary","in":"header","name":"authorization","type":"bearer"}],"mode":"required"},"errorProjections":[],"id":"account.get.int-context","method":"GET","path":"/account-int","permission":"account.read","provenance":{"kind":"native","sources":["repo:api.api#route%3AGET%20%2Faccount-int"]},"requestType":"GetIntRequest","responseBody":"json","responseType":"Account"},{"auth":{"credentials":[{"id":"primary","in":"header","name":"authorization","type":"bearer"}],"mode":"required"},"errorProjections":[],"id":"account.list","method":"GET","path":"/accounts","permission":"account.read","provenance":{"kind":"native","sources":["repo:api.api#route%3AGET%20%2Faccounts"]},"requestType":"ListRequest","responseBody":"json","responseType":"ListResponse"},{"auth":{"credentials":[],"mode":"none"},"errorProjections":[],"id":"account.options","method":"GET","path":"/account-options","permission":"","provenance":{"kind":"native","sources":["repo:api.api#route%3AGET%20%2Faccount-options"]},"requestType":"OptionsRequest","responseBody":"json","responseType":"OptionsResponse"},{"auth":{"credentials":[],"mode":"none"},"errorProjections":[],"id":"account.options.extra","method":"GET","path":"/account-options-extra","permission":"","provenance":{"kind":"native","sources":["repo:api.api#route%3AGET%20%2Faccount-options-extra"]},"requestType":"OptionsExtraRequest","responseBody":"json","responseType":"OptionsResponse"},{"auth":{"credentials":[{"id":"primary","in":"header","name":"authorization","type":"bearer"}],"mode":"required"},"errorProjections":[],"id":"account.status","method":"PUT","path":"/accounts/{id}/status","permission":"account.write","provenance":{"kind":"native","sources":["repo:api.api#route%3APUT%20%2Faccounts%2F%7Bid%7D%2Fstatus"]},"requestType":"UpdateStatusRequest","responseBody":"none"}],"sourceDigest":"sha256:8735688a1fe857f871baeb9049e00e6de3a3426ca8d9fbdb5de447c47e0459ba","sources":[{"digest":"sha256:1a0973628c562991e8da80ffef49fa8760f89455bce0491ea4a34e5a758f825a","ref":"repo:api.api#field%3AAccount.Count"},{"digest":"sha256:62d7005538d482c78fe5d1792d25da6a38e18fb48da49e63346646adbcd97ee8","ref":"repo:api.api#field%3AAccount.ID"},{"digest":"sha256:85939b00e608275aa1394333d0c7f38d2db1e076843a7f28b32750bcc203d327","ref":"repo:api.api#field%3AAccount.Name"},{"digest":"sha256:617a897bf02865b82942ead7312fd4dfaf690c2da2ff78b58ffdde0dfeaa23fc","ref":"repo:api.api#field%3AAccount.OptionalID"},{"digest":"sha256:e22ff39e931e0f8d7e9669a96714a0d9806e2aacda4d81f2d2e2062f39969951","ref":"repo:api.api#field%3AAccount.Profile"},{"digest":"sha256:1074956e1fb1d90a4993cd9e264455d9f14b69a35f704836dd74fbd7dfefb92f","ref":"repo:api.api#field%3AAccount.Qualities"},{"digest":"sha256:73320714838362b279e92f80509e185ff544f14c56f6ff7c616520594f1fc66a","ref":"repo:api.api#field%3AAccount.Status"},{"digest":"sha256:fc77b1fb5f89bf3d0a9b1300f933525ef694282c553b20e4ded45fc283cacc32","ref":"repo:api.api#field%3ACreateRequest.Name"},{"digest":"sha256:f8b5a73e6c0e7366cf5aa22a83e46a8f40619220df15d799f44a34d635d7b84c","ref":"repo:api.api#field%3ACreateRequest.TenantID"},{"digest":"sha256:9a5c5ffacfe8b039fbfd78329bac3a882f2c232af7c98bf7b48d5c5d42010e70","ref":"repo:api.api#field%3ADeleteRequest.ID"},{"digest":"sha256:d24b167d15a2f8e6ba2e5c3140029e7e74f0d9f7fa7820a368f34943a9d7df26","ref":"repo:api.api#field%3ADeleteRequest.TenantID"},{"digest":"sha256:f257d51bb716f16d935bb4578e64eed8ef26e45646c43c441730bbe2f6f95aaa","ref":"repo:api.api#field%3AGetIntRequest.TenantID"},{"digest":"sha256:af630a16b1b65218bb9f9c6d8da206dc315aea810a511736784cd75d11a236aa","ref":"repo:api.api#field%3AGetRequest.TenantID"},{"digest":"sha256:a1393c498141cc9ad6693d4b6021bcd4e69cce2f2f8c7b498ea3ad36bb4b32ed","ref":"repo:api.api#field%3AListRequest.Limit"},{"digest":"sha256:beb8f5a1318a02d0759024a94d407d83ccddfb7bbbb7072f48d872bfe6bfb85c","ref":"repo:api.api#field%3AListRequest.Offset"},{"digest":"sha256:989048d2ae8ef6a386d39b5c23d78f89e0eaeb7e5bebe3ed9020b948e413a731","ref":"repo:api.api#field%3AListRequest.Other"},{"digest":"sha256:d3a5b3065e16c7532106d17eddd283624b95f22c630d96a5664d22317acf2eeb","ref":"repo:api.api#field%3AListRequest.Query"},{"digest":"sha256:eef76ee17a7243573d3bc4f909735e40897aafca4f0ab8262d66abddecf6b01b","ref":"repo:api.api#field%3AListRequest.TenantID"},{"digest":"sha256:87ebc1a14d7d7fcf67734c5d2c60ca8d4e592e3a3c72505861c796b1ebbd7bc5","ref":"repo:api.api#field%3AListResponse.Items"},{"digest":"sha256:3ca7939b7eed4204235405f7c8cb1e2bdc94b0fdf2e4291109ef8e87c0e0b339","ref":"repo:api.api#field%3AListResponse.Total"},{"digest":"sha256:42c27eb647e07438b8eed5e7a5099a6f4f9d18840fb576ff97bc28e18be07be1","ref":"repo:api.api#field%3AOption.Code"},{"digest":"sha256:f5130f437e3c27e4d13b6af105858775f676cd9c94fdeec5b038aecce86de176","ref":"repo:api.api#field%3AOption.Label"},{"digest":"sha256:f420533f11c2f902e0fd7ad5c4a06d2ebdccf9e0a67d305457026f27207767c2","ref":"repo:api.api#field%3AOptionsExtraRequest.Filter"},{"digest":"sha256:177c17382ed9c28cd3c760f4e2ad1d7a1d7b0af9092503438228568cc5466082","ref":"repo:api.api#field%3AOptionsExtraRequest.Limit"},{"digest":"sha256:cd615e3a3ddb75a398de4b1529f944e3edd81ab3a6eb2b1bcb99fc9e75bd160e","ref":"repo:api.api#field%3AOptionsExtraRequest.Offset"},{"digest":"sha256:3fce83452e4685ec7639f78984d15bcc54aa552ee5c7fadb77f619a76fedc68b","ref":"repo:api.api#field%3AOptionsExtraRequest.TenantID"},{"digest":"sha256:b26026581464350a9d9704f60887dbcd05c5fc40cbba704b2f2592468be7ec84","ref":"repo:api.api#field%3AOptionsRequest.Limit"},{"digest":"sha256:fb6bc4e3c93511001bb63262ee34b6b375dfc632c217ff097b36fe949e3b5283","ref":"repo:api.api#field%3AOptionsRequest.Offset"},{"digest":"sha256:659601949d87836eb07e61425dbc381523f0c1f8394f44f74dbe86a6951bab83","ref":"repo:api.api#field%3AOptionsRequest.TenantID"},{"digest":"sha256:54012037beb6c3902cee1d88d8c49094d11b9b642d83a13ab0e47f8b5a8121a8","ref":"repo:api.api#field%3AOptionsResponse.Items"},{"digest":"sha256:071237b00e5c30aba4c25059987384d7689cee7f764c10af6ea368273c600054","ref":"repo:api.api#field%3AOptionsResponse.Total"},{"digest":"sha256:ec24a3d4b3bf781f2708e9db2c9f0ada097e81a46da36d2e6258911d80848450","ref":"repo:api.api#field%3AProfile.Label"},{"digest":"sha256:d80218987902c55da146bbae2dce4bafbdfe190c15045aedf6c1e5a46aa62ffc","ref":"repo:api.api#field%3AQuality.Code"},{"digest":"sha256:339189a9c10082e627d55f1f53db9c54890a229a54411f740af89ab23f83dceb","ref":"repo:api.api#field%3AQuality.Score"},{"digest":"sha256:1e0d040697b5cbdaf262db0a21254c40703a86f1d74ee73f40a6600e07daf210","ref":"repo:api.api#field%3AQuality.Tags"},{"digest":"sha256:65bcc0996d969f9e6d3b285beee03fa91676028f3edd0f3e157b20d22dde8f27","ref":"repo:api.api#field%3AUpdateStatusRequest.Choices"},{"digest":"sha256:cc4778a66c7254159d854b859d86f58abe6afd5180b609905c5b142af847051e","ref":"repo:api.api#field%3AUpdateStatusRequest.Count"},{"digest":"sha256:ff8cd68db35fc192ec06be09adbade13913e2f45ea9744b56eaec353ee3f17bf","ref":"repo:api.api#field%3AUpdateStatusRequest.ID"},{"digest":"sha256:3ac370d45fbf5c3c5451009f87ed40ba2ab4c75e92c42b9211b0093525bdcdd3","ref":"repo:api.api#field%3AUpdateStatusRequest.Status"},{"digest":"sha256:4ad1f7416a447ef8fb22766b63253dfbbe5001212abfb94ae69b372027625c67","ref":"repo:api.api#field%3AUpdateStatusRequest.TenantID"},{"digest":"sha256:825116aeda7187549c9fdd0ad7f680c44aa9e00d21113dc4c03ff0d0bc3e9a70","ref":"repo:api.api#route%3ADELETE%20%2Faccounts%2F%7Bid%7D"},{"digest":"sha256:bf95360ce9ae36fda2bc7d664398c529d6f322e94f026e93a8af4eade0e3c8d0","ref":"repo:api.api#route%3AGET%20%2Faccount"},{"digest":"sha256:fef1f0f40c1dba6ea9b6296337e057e6e6339518b8f7968ccfaa1bdb04281857","ref":"repo:api.api#route%3AGET%20%2Faccount-int"},{"digest":"sha256:592606c00c5e506d4e8e21db1bb28358f10026e9acdb17da495ea4cd15664801","ref":"repo:api.api#route%3AGET%20%2Faccount-options"},{"digest":"sha256:173d92a89619ec1bf35be94d6ac9898994aec06a0044207e349aaf1f58499884","ref":"repo:api.api#route%3AGET%20%2Faccount-options-extra"},{"digest":"sha256:7782631977aa363b7145be099feba399f010e97a02f29ded4afc902efa8aef87","ref":"repo:api.api#route%3AGET%20%2Faccounts"},{"digest":"sha256:2de5f1eb94febc86c64bf9a27561d353de64cbfcc633da71375831299bb1fdef","ref":"repo:api.api#route%3APOST%20%2Faccounts"},{"digest":"sha256:dde8571680d7d7e546c4b49501992b9fa1593be1530aee037588d2a69d122713","ref":"repo:api.api#route%3APUT%20%2Faccounts%2F%7Bid%7D%2Fstatus"},{"digest":"sha256:53122c45051496ab9c419f0a84c096b0fe1852cd7c1c8e966b9dcaec431c3975","ref":"repo:api.api#type%3AAccount"},{"digest":"sha256:a21a7f433468b8dd6c362d915449ef246b9be881232944bc7d96383e4adab4d0","ref":"repo:api.api#type%3ACreateRequest"},{"digest":"sha256:e2115d1d51df9be4ac1dfe64c8253